<?xml version="1.0" encoding="UTF-8"?>
<!-- ***************************************************************** -->
<!--                                                                   -->
<!-- Licensed Materials - Property of IBM                              -->
<!--                                                                   -->
<!-- IBM SPSS Products: Statistics Common                              -->
<!--                                                                   -->
<!-- (C) Copyright IBM Corp. 1989, 2011                                -->
<!--                                                                   -->
<!-- US Government Users Restricted Rights - Use, duplication or       -->
<!-- disclosure restricted by GSA ADP Schedule Contract with IBM       -->
<!-- Corp.                                                             -->
<!--                                                                   -->
<!-- ***************************************************************** -->


<xs:schema targetNamespace="http://xml.spss.com/spss/mls" xmlns="http://xml.spss.com/spss/mls" xmlns:xs="http://www.w3.org/2001/XMLSchema" elementFormDefault="qualified" attributeFormDefault="unqualified" version="1.0">
	<xs:annotation>
		<xs:documentation xml:lang="en">Copyright 2003 SPSS Inc - All Rights Reserved.  SPSS specifically disclaims all warranties with respect to your use of this specification, expressed, implied, or otherwise, including without limitation, all warranties of merchantability and fitness for a particular purpose.  SPSS shall not be liable for any special, incidental, or consequential damages, including without limitation lost revenues or lost profits resulting from the use of the information herein.</xs:documentation>
	</xs:annotation>
	<xs:element name="client-locale">
		<xs:complexType>
			<xs:sequence>
				<xs:element ref="server-locale" maxOccurs="unbounded"/>
			</xs:sequence>
			<xs:attribute name="name" type="xs:string" use="required"/>
		</xs:complexType>
	</xs:element>
	<xs:element name="server-locale">
		<xs:complexType>
			<xs:attribute name="name" type="xs:string" use="required"/>
		</xs:complexType>
	</xs:element>
	<xs:element name="locale-map">
		<xs:complexType>
			<xs:sequence>
				<xs:element ref="client-locale" maxOccurs="unbounded"/>
			</xs:sequence>
		</xs:complexType>
	</xs:element>
</xs:schema>
